<?xml version="1.0" encoding="utf-8"?>
<addml xmlns="http://www.arkivverket.no/standarder/addml" xmlns:xsi="http://www.w3.org/2001/XMLSchema-instance" xsi:schemaLocation="http://www.arkivverket.no/standarder/addml addml.xsd" name="Noark 5-arkivuttrekk">
	<dataset>
		<description>Noark 5-arkivuttrekk</description>
		<reference>
			<context>
				<additionalElements>
					<additionalElement name="recordCreators">
						<additionalElements>
							<additionalElement name="recordCreator">
								<value>Arbeids- og velferdsetaten</value>
							</additionalElement>
						</additionalElements>
					</additionalElement>
					<additionalElement name="systemType">
						<!-- Oppgi type system/lÃ¸sning arkivuttrekket kom fra -->
						<value>Journal og arkivsystem</value>
					</additionalElement>
					<additionalElement name="systemName">
						<!-- Oppgi navn pÃ¥ system/lÃ¸sning -->
						<value>Joark</value>
					</additionalElement>
					<additionalElement name="archive">
						<!-- Oppgi navn pÃ¥ arkiv -->
						<value>NAV Fagarkiv</value>
					</additionalElement>
				</additionalElements>
			</context>
			<content>
				<additionalElements>
					<additionalElement name="archivalPeriod">
						<properties>
							<property name="startDate">
								<!-- Ã…Ã…Ã…Ã…-MM-DD -->
								<value>2010-02-18</value>
							</property>
							<property name="endDate">
								<!-- Ã…Ã…Ã…Ã…-MM-DD -->
								<value>$AVLEVERING_SLUTTDATO$</value>
							</property>
						</properties>
					</additionalElement>
				</additionalElements>
			</content>
		</reference>
		<dataObjects>
			<dataObject name="Noark 5-arkivuttrekk">
				<properties>
					<property name="info">
						<properties>
							<property name="type">
								<value>Noark 5</value>
								<properties>
									<property name="version">
										<value>5.0</value>
									</property>
								</properties>
							</property>
							<property name="additionalInfo">
								<properties>
									<property name="periode">
										<properties>
											<property name="inngaaendeSkille">
												<value>mykt</value>
											</property>
											<property name="utgaaendeSkille">
												<value>mykt</value>
											</property>
										</properties>
									</property>
									<property dataType="boolean" name="inneholderSkjermetInformasjon">
										<value>true</value>
									</property>
									<property dataType="boolean" name="omfatterDokumenterSomErKassert">
										<value>false</value>
									</property>
									<property dataType="boolean" name="inneholderDokumenterSomSkalKasseres">
										<value>false</value>
									</property>
									<property dataType="boolean" name="inneholderVirksomhetsspesifikkeMetadata">
										<value>false</value>
									</property>
									<property dataType="integer" name="antallDokumentfiler">
										<value>$AVLEVERING_ANTALLDOKUMENTER$</value>
									</property>
								</properties>
							</property>
						</properties>
					</property>
				</properties>
				<dataObjects>
					<dataObject name="arkivstruktur">
						<properties>
							<property name="file">
								<properties>
									<property name="name">
										<value>arkivstruktur.xml</value>
									</property>
									<property name="format">
										<value>XML</value>
										<properties>
											<property name="version">
												<value>1.0</value>
											</property>
										</properties>
									</property>
									<property name="checksum">
										<properties>
											<property name="algorithm">
												<value>SHA-256</value>
											</property>
											<property name="value">
												<value>$ARKIVSTRUKTUR_XML_SJEKKSUM$</value>
											</property>
										</properties>
									</property>
								</properties>
							</property>
							<property name="schema">
								<value>main</value>
								<properties>
									<property name="file">
										<properties>
											<property name="name">
												<value>arkivstruktur.xsd</value>
											</property>
											<property name="format">
												<value>XML</value>
												<properties>
													<property name="version">
														<value>1.0</value>
													</property>
												</properties>
											</property>
											<property name="checksum">
												<properties>
													<property name="algorithm">
														<value>SHA-256</value>
													</property>
													<property name="value">
														<value>$ARKIVSTRUKTUR_XSD_SJEKKSUM$</value>
													</property>
												</properties>
											</property>
										</properties>
									</property>
									<property name="type">
										<value>XML Schema</value>
										<properties>
											<property name="version">
												<value>1.0</value>
											</property>
										</properties>
									</property>
								</properties>
							</property>
							<property name="schema">
								<properties>
									<property name="file">
										<properties>
											<property name="name">
												<value>metadatakatalog.xsd</value>
											</property>
											<property name="format">
												<value>XML</value>
												<properties>
													<property name="version">
														<value>1.0</value>
													</property>
												</properties>
											</property>
											<property name="checksum">
												<properties>
													<property name="algorithm">
														<value>SHA-256</value>
													</property>
													<property name="value">
														<value>$METADATAKATALOG_XSD_SJEKKSUM$</value>
													</property>
												</properties>
											</property>
										</properties>
									</property>
									<property name="type">
										<value>XML Schema</value>
										<properties>
											<property name="version">
												<value>1.0</value>
											</property>
										</properties>
									</property>
								</properties>
							</property>
							<property name="info">
								<properties>
									<property name="numberOfOccurrences">
										<value>mappe</value>
										<properties>
											<property name="elementPath">
												<value>//mappe</value>
											</property>
											<property dataType="integer" name="value">
												<value>$ARKIVSTRUKTUR_ANTALL_MAPPE$</value>
											</property>
										</properties>
									</property>
									<property name="numberOfOccurrences">
										<value>registrering</value>
										<properties>
											<property name="elementPath">
												<value>//registrering</value>
											</property>
											<property dataType="integer" name="value">
												<value>$ARKIVSTRUKTUR_ANTALL_REGISTRERING$</value>
											</property>
										</properties>
									</property>
								</properties>
							</property>
						</properties>
					</dataObject>
					<dataObject name="endringslogg">
						<properties>
							<property name="file">
								<properties>
									<property name="name">
										<value>endringslogg.xml</value>
									</property>
									<property name="format">
										<value>XML</value>
										<properties>
											<property name="version">
												<value>1.0</value>
											</property>
										</properties>
									</property>
									<property name="checksum">
										<properties>
											<property name="algorithm">
												<value>SHA-256</value>
											</property>
											<property name="value">
												<value>$ENDRINGSLOGG_XML_SJEKKSUM$</value>
											</property>
										</properties>
									</property>
								</properties>
							</property>
							<property name="schema">
								<!-- Angi med <value>main</value> om fil skal eksplisitt importeres ved validering. Hvis ikke skal skjema importeres via annen xsd. -->
								<value>main</value>
								<properties>
									<property name="file">
										<properties>
											<property name="name">
												<value>endringslogg.xsd</value>
											</property>
											<property name="format">
												<value>XML</value>
												<properties>
													<property name="version">
														<value>1.0</value>
													</property>
												</properties>
											</property>
											<property name="checksum">
												<properties>
													<property name="algorithm">
														<value>SHA-256</value>
													</property>
													<property name="value">
														<value>$ENDRINGSLOGG_XSD_SJEKKSUM$</value>
													</property>
												</properties>
											</property>
										</properties>
									</property>
									<property name="type">
										<value>XML Schema</value>
										<properties>
											<property name="version">
												<value>1.0</value>
											</property>
										</properties>
									</property>
								</properties>
							</property>
							<property name="schema">
								<!-- Angi med <value>main</value> om fil skal eksplisitt importeres ved validering. Hvis ikke skal skjema importeres via annen xsd. -->
								<properties>
									<property name="file">
										<properties>
											<property name="name">
												<value>metadatakatalog.xsd</value>
											</property>
										</properties>
									</property>
								</properties>
							</property>
							<property name="info">
								<properties>
									<property name="numberOfOccurrences">
										<value>endring</value>
										<properties>
											<property name="elementPath">
												<value>//endring</value>
											</property>
											<property dataType="integer" name="value">
												<value>$ENDRINGSLOGG_ANTALL_ENDRING$</value>
											</property>
										</properties>
									</property>
								</properties>
							</property>
						</properties>
					</dataObject>